{
  "format": "kontexte.mission/1",
  "id": "chantier-maquette",
  "version": "0.1.0",
  "synthetic": true,
  "title": {
    "fr-CA": "Le chantier de l’architecte",
    "en": "Architect model"
  },
  "fiction": {
    "fr-CA": "Mission de simulation du monde Le chantier de l’architecte.",
    "en": "Simulation mission: Architect model."
  },
  "year_suggestion": 3,
  "roles": [
    "architecte",
    "menuisier",
    "regisseur"
  ],
  "steps": [
    {
      "id": "phase-1",
      "role": "architecte",
      "instruction": {
        "fr-CA": "Dessiner le plan",
        "en": "Dessiner le plan"
      },
      "kind": "document",
      "depends_on": [],
      "curriculum_ids": [
        "qc-pri-ap-003"
      ],
      "validation": "human_review"
    },
    {
      "id": "phase-2",
      "role": "menuisier",
      "instruction": {
        "fr-CA": "Fabriquer la maquette",
        "en": "Fabriquer la maquette"
      },
      "kind": "object",
      "depends_on": [
        "phase-1"
      ],
      "curriculum_ids": [
        "qc-pri-ap-003"
      ],
      "validation": "human_review"
    },
    {
      "id": "phase-3",
      "role": "regisseur",
      "instruction": {
        "fr-CA": "Installer",
        "en": "Installer"
      },
      "kind": "object",
      "depends_on": [
        "phase-2"
      ],
      "curriculum_ids": [
        "qc-pri-ap-003"
      ],
      "validation": "human_review"
    }
  ],
  "fragments": [
    {
      "id": "indice-un",
      "holder_role": "architecte",
      "content": {
        "fr-CA": "Le premier groupe détient une mesure.",
        "en": "The first group has a measurement."
      },
      "release": "orgo_authorized",
      "visibility": "participant"
    },
    {
      "id": "indice-deux",
      "holder_role": "menuisier",
      "content": {
        "fr-CA": "Le deuxième groupe détient une quantité.",
        "en": "The second group has a quantity."
      },
      "release": "orgo_authorized",
      "visibility": "participant"
    }
  ],
  "joins": [
    {
      "id": "jointure-infos",
      "fragment_ids": [
        "indice-un",
        "indice-deux"
      ],
      "unlock_step": "phase-3"
    }
  ],
  "adaptation": {
    "accompagne": {
      "instruction": "Consignes courtes, pictogrammes et aide disponible, sans étiquette publique."
    },
    "standard": {
      "instruction": "Autonomie progressive et défis adaptés."
    },
    "approfondi": {
      "instruction": "Information partielle, décisions en plusieurs étapes et justification."
    }
  },
  "status": "scenario_skeleton_requires_pedagogical_review"
}
