{
  "format": "kontexte.mission/1",
  "id": "atelier-mecanique",
  "version": "0.1.0",
  "synthetic": true,
  "title": {
    "fr-CA": "L’atelier du mécanicien",
    "en": "Mechanic workshop"
  },
  "fiction": {
    "fr-CA": "Mission de simulation du monde L’atelier du mécanicien.",
    "en": "Simulation mission: Mechanic workshop."
  },
  "year_suggestion": 3,
  "roles": [
    "mecanicien",
    "inventeur",
    "scientifique"
  ],
  "steps": [
    {
      "id": "phase-1",
      "role": "mecanicien",
      "instruction": {
        "fr-CA": "Inspecter la roue",
        "en": "Inspecter la roue"
      },
      "kind": "document",
      "depends_on": [],
      "curriculum_ids": [
        "qc-pri-ma-006"
      ],
      "validation": "human_review"
    },
    {
      "id": "phase-2",
      "role": "inventeur",
      "instruction": {
        "fr-CA": "Mesurer la pièce",
        "en": "Mesurer la pièce"
      },
      "kind": "object",
      "depends_on": [
        "phase-1"
      ],
      "curriculum_ids": [
        "qc-pri-ma-006"
      ],
      "validation": "human_review"
    },
    {
      "id": "phase-3",
      "role": "scientifique",
      "instruction": {
        "fr-CA": "Tester le prototype",
        "en": "Tester le prototype"
      },
      "kind": "object",
      "depends_on": [
        "phase-2"
      ],
      "curriculum_ids": [
        "qc-pri-ma-006"
      ],
      "validation": "human_review"
    }
  ],
  "fragments": [
    {
      "id": "indice-un",
      "holder_role": "mecanicien",
      "content": {
        "fr-CA": "Le premier groupe détient une mesure.",
        "en": "The first group has a measurement."
      },
      "release": "orgo_authorized",
      "visibility": "participant"
    },
    {
      "id": "indice-deux",
      "holder_role": "inventeur",
      "content": {
        "fr-CA": "Le deuxième groupe détient une quantité.",
        "en": "The second group has a quantity."
      },
      "release": "orgo_authorized",
      "visibility": "participant"
    }
  ],
  "joins": [
    {
      "id": "jointure-infos",
      "fragment_ids": [
        "indice-un",
        "indice-deux"
      ],
      "unlock_step": "phase-3"
    }
  ],
  "adaptation": {
    "accompagne": {
      "instruction": "Consignes courtes, pictogrammes et aide disponible, sans étiquette publique."
    },
    "standard": {
      "instruction": "Autonomie progressive et défis adaptés."
    },
    "approfondi": {
      "instruction": "Information partielle, décisions en plusieurs étapes et justification."
    }
  },
  "status": "scenario_skeleton_requires_pedagogical_review"
}
