{
  "format": "kontexte.mission/1",
  "id": "laboratoire",
  "version": "0.1.0",
  "synthetic": true,
  "title": {
    "fr-CA": "Le laboratoire",
    "en": "Laboratory"
  },
  "fiction": {
    "fr-CA": "Mission de simulation du monde Le laboratoire.",
    "en": "Simulation mission: Laboratory."
  },
  "year_suggestion": 3,
  "roles": [
    "scientifique",
    "inventeur",
    "photographe"
  ],
  "steps": [
    {
      "id": "phase-1",
      "role": "scientifique",
      "instruction": {
        "fr-CA": "Poser une hypothèse",
        "en": "Poser une hypothèse"
      },
      "kind": "document",
      "depends_on": [],
      "curriculum_ids": [
        "qc-pri-ma-006"
      ],
      "validation": "human_review"
    },
    {
      "id": "phase-2",
      "role": "inventeur",
      "instruction": {
        "fr-CA": "Tester un objet fictif",
        "en": "Tester un objet fictif"
      },
      "kind": "object",
      "depends_on": [
        "phase-1"
      ],
      "curriculum_ids": [
        "qc-pri-ma-006"
      ],
      "validation": "human_review"
    },
    {
      "id": "phase-3",
      "role": "photographe",
      "instruction": {
        "fr-CA": "Documenter",
        "en": "Documenter"
      },
      "kind": "object",
      "depends_on": [
        "phase-2"
      ],
      "curriculum_ids": [
        "qc-pri-ma-006"
      ],
      "validation": "human_review"
    }
  ],
  "fragments": [
    {
      "id": "indice-un",
      "holder_role": "scientifique",
      "content": {
        "fr-CA": "Le premier groupe détient une mesure.",
        "en": "The first group has a measurement."
      },
      "release": "orgo_authorized",
      "visibility": "participant"
    },
    {
      "id": "indice-deux",
      "holder_role": "inventeur",
      "content": {
        "fr-CA": "Le deuxième groupe détient une quantité.",
        "en": "The second group has a quantity."
      },
      "release": "orgo_authorized",
      "visibility": "participant"
    }
  ],
  "joins": [
    {
      "id": "jointure-infos",
      "fragment_ids": [
        "indice-un",
        "indice-deux"
      ],
      "unlock_step": "phase-3"
    }
  ],
  "adaptation": {
    "accompagne": {
      "instruction": "Consignes courtes, pictogrammes et aide disponible, sans étiquette publique."
    },
    "standard": {
      "instruction": "Autonomie progressive et défis adaptés."
    },
    "approfondi": {
      "instruction": "Information partielle, décisions en plusieurs étapes et justification."
    }
  },
  "status": "scenario_skeleton_requires_pedagogical_review"
}
