{
  "format": "kontexte.mission/1",
  "id": "spectacle-clown",
  "version": "0.1.0",
  "synthetic": true,
  "title": {
    "fr-CA": "Le spectacle du clown",
    "en": "Clown show"
  },
  "fiction": {
    "fr-CA": "Mission de simulation du monde Le spectacle du clown.",
    "en": "Simulation mission: Clown show."
  },
  "year_suggestion": 3,
  "roles": [
    "clown",
    "metteur-en-scene",
    "musicien"
  ],
  "steps": [
    {
      "id": "phase-1",
      "role": "clown",
      "instruction": {
        "fr-CA": "Inventer le numéro",
        "en": "Inventer le numéro"
      },
      "kind": "document",
      "depends_on": [],
      "curriculum_ids": [
        "qc-pri-ad-001"
      ],
      "validation": "human_review"
    },
    {
      "id": "phase-2",
      "role": "metteur-en-scene",
      "instruction": {
        "fr-CA": "Préparer le rythme",
        "en": "Préparer le rythme"
      },
      "kind": "object",
      "depends_on": [
        "phase-1"
      ],
      "curriculum_ids": [
        "qc-pri-ad-001"
      ],
      "validation": "human_review"
    },
    {
      "id": "phase-3",
      "role": "musicien",
      "instruction": {
        "fr-CA": "Présenter",
        "en": "Présenter"
      },
      "kind": "object",
      "depends_on": [
        "phase-2"
      ],
      "curriculum_ids": [
        "qc-pri-ad-001"
      ],
      "validation": "human_review"
    }
  ],
  "fragments": [
    {
      "id": "indice-un",
      "holder_role": "clown",
      "content": {
        "fr-CA": "Le premier groupe détient une mesure.",
        "en": "The first group has a measurement."
      },
      "release": "orgo_authorized",
      "visibility": "participant"
    },
    {
      "id": "indice-deux",
      "holder_role": "metteur-en-scene",
      "content": {
        "fr-CA": "Le deuxième groupe détient une quantité.",
        "en": "The second group has a quantity."
      },
      "release": "orgo_authorized",
      "visibility": "participant"
    }
  ],
  "joins": [
    {
      "id": "jointure-infos",
      "fragment_ids": [
        "indice-un",
        "indice-deux"
      ],
      "unlock_step": "phase-3"
    }
  ],
  "adaptation": {
    "accompagne": {
      "instruction": "Consignes courtes, pictogrammes et aide disponible, sans étiquette publique."
    },
    "standard": {
      "instruction": "Autonomie progressive et défis adaptés."
    },
    "approfondi": {
      "instruction": "Information partielle, décisions en plusieurs étapes et justification."
    }
  },
  "status": "scenario_skeleton_requires_pedagogical_review"
}
