{
  "format": "kontexte.mission/1",
  "id": "conseil-village",
  "version": "0.1.0",
  "synthetic": true,
  "title": {
    "fr-CA": "Le conseil du village",
    "en": "Village council"
  },
  "fiction": {
    "fr-CA": "Mission de simulation du monde Le conseil du village.",
    "en": "Simulation mission: Village council."
  },
  "year_suggestion": 3,
  "roles": [
    "politicien",
    "redacteur",
    "lecteur"
  ],
  "steps": [
    {
      "id": "phase-1",
      "role": "politicien",
      "instruction": {
        "fr-CA": "Proposer une règle",
        "en": "Proposer une règle"
      },
      "kind": "document",
      "depends_on": [],
      "curriculum_ids": [
        "qc-pri-fr-021"
      ],
      "validation": "human_review"
    },
    {
      "id": "phase-2",
      "role": "redacteur",
      "instruction": {
        "fr-CA": "Écrire les arguments",
        "en": "Écrire les arguments"
      },
      "kind": "object",
      "depends_on": [
        "phase-1"
      ],
      "curriculum_ids": [
        "qc-pri-fr-021"
      ],
      "validation": "human_review"
    },
    {
      "id": "phase-3",
      "role": "lecteur",
      "instruction": {
        "fr-CA": "Délibérer",
        "en": "Délibérer"
      },
      "kind": "object",
      "depends_on": [
        "phase-2"
      ],
      "curriculum_ids": [
        "qc-pri-fr-021"
      ],
      "validation": "human_review"
    }
  ],
  "fragments": [
    {
      "id": "indice-un",
      "holder_role": "politicien",
      "content": {
        "fr-CA": "Le premier groupe détient une mesure.",
        "en": "The first group has a measurement."
      },
      "release": "orgo_authorized",
      "visibility": "participant"
    },
    {
      "id": "indice-deux",
      "holder_role": "redacteur",
      "content": {
        "fr-CA": "Le deuxième groupe détient une quantité.",
        "en": "The second group has a quantity."
      },
      "release": "orgo_authorized",
      "visibility": "participant"
    }
  ],
  "joins": [
    {
      "id": "jointure-infos",
      "fragment_ids": [
        "indice-un",
        "indice-deux"
      ],
      "unlock_step": "phase-3"
    }
  ],
  "adaptation": {
    "accompagne": {
      "instruction": "Consignes courtes, pictogrammes et aide disponible, sans étiquette publique."
    },
    "standard": {
      "instruction": "Autonomie progressive et défis adaptés."
    },
    "approfondi": {
      "instruction": "Information partielle, décisions en plusieurs étapes et justification."
    }
  },
  "status": "scenario_skeleton_requires_pedagogical_review"
}
