{
  "format": "kontexte.mission/1",
  "id": "jardin-fermier",
  "version": "0.1.0",
  "synthetic": true,
  "title": {
    "fr-CA": "Le jardin du fermier",
    "en": "Farm garden"
  },
  "fiction": {
    "fr-CA": "Mission de simulation du monde Le jardin du fermier.",
    "en": "Simulation mission: Farm garden."
  },
  "year_suggestion": 3,
  "roles": [
    "fermier",
    "jardinier",
    "scientifique"
  ],
  "steps": [
    {
      "id": "phase-1",
      "role": "fermier",
      "instruction": {
        "fr-CA": "Observer la graine",
        "en": "Observer la graine"
      },
      "kind": "document",
      "depends_on": [],
      "curriculum_ids": [
        "qc-pri-ma-006"
      ],
      "validation": "human_review"
    },
    {
      "id": "phase-2",
      "role": "jardinier",
      "instruction": {
        "fr-CA": "Mesurer les pousses",
        "en": "Mesurer les pousses"
      },
      "kind": "object",
      "depends_on": [
        "phase-1"
      ],
      "curriculum_ids": [
        "qc-pri-ma-006"
      ],
      "validation": "human_review"
    },
    {
      "id": "phase-3",
      "role": "scientifique",
      "instruction": {
        "fr-CA": "Comparer",
        "en": "Comparer"
      },
      "kind": "object",
      "depends_on": [
        "phase-2"
      ],
      "curriculum_ids": [
        "qc-pri-ma-006"
      ],
      "validation": "human_review"
    }
  ],
  "fragments": [
    {
      "id": "indice-un",
      "holder_role": "fermier",
      "content": {
        "fr-CA": "Le premier groupe détient une mesure.",
        "en": "The first group has a measurement."
      },
      "release": "orgo_authorized",
      "visibility": "participant"
    },
    {
      "id": "indice-deux",
      "holder_role": "jardinier",
      "content": {
        "fr-CA": "Le deuxième groupe détient une quantité.",
        "en": "The second group has a quantity."
      },
      "release": "orgo_authorized",
      "visibility": "participant"
    }
  ],
  "joins": [
    {
      "id": "jointure-infos",
      "fragment_ids": [
        "indice-un",
        "indice-deux"
      ],
      "unlock_step": "phase-3"
    }
  ],
  "adaptation": {
    "accompagne": {
      "instruction": "Consignes courtes, pictogrammes et aide disponible, sans étiquette publique."
    },
    "standard": {
      "instruction": "Autonomie progressive et défis adaptés."
    },
    "approfondi": {
      "instruction": "Information partielle, décisions en plusieurs étapes et justification."
    }
  },
  "status": "scenario_skeleton_requires_pedagogical_review"
}
