{
  "format": "kontexte.mission/1",
  "id": "expedition",
  "version": "0.1.0",
  "synthetic": true,
  "title": {
    "fr-CA": "L’expédition",
    "en": "Expedition"
  },
  "fiction": {
    "fr-CA": "Mission de simulation du monde L’expédition.",
    "en": "Simulation mission: Expedition."
  },
  "year_suggestion": 3,
  "roles": [
    "explorateur",
    "messager",
    "scientifique"
  ],
  "steps": [
    {
      "id": "phase-1",
      "role": "explorateur",
      "instruction": {
        "fr-CA": "Tracer le chemin",
        "en": "Tracer le chemin"
      },
      "kind": "document",
      "depends_on": [],
      "curriculum_ids": [
        "qc-pri-fr-021"
      ],
      "validation": "human_review"
    },
    {
      "id": "phase-2",
      "role": "messager",
      "instruction": {
        "fr-CA": "Transmettre un indice",
        "en": "Transmettre un indice"
      },
      "kind": "object",
      "depends_on": [
        "phase-1"
      ],
      "curriculum_ids": [
        "qc-pri-fr-021"
      ],
      "validation": "human_review"
    },
    {
      "id": "phase-3",
      "role": "scientifique",
      "instruction": {
        "fr-CA": "Rendre compte",
        "en": "Rendre compte"
      },
      "kind": "object",
      "depends_on": [
        "phase-2"
      ],
      "curriculum_ids": [
        "qc-pri-fr-021"
      ],
      "validation": "human_review"
    }
  ],
  "fragments": [
    {
      "id": "indice-un",
      "holder_role": "explorateur",
      "content": {
        "fr-CA": "Le premier groupe détient une mesure.",
        "en": "The first group has a measurement."
      },
      "release": "orgo_authorized",
      "visibility": "participant"
    },
    {
      "id": "indice-deux",
      "holder_role": "messager",
      "content": {
        "fr-CA": "Le deuxième groupe détient une quantité.",
        "en": "The second group has a quantity."
      },
      "release": "orgo_authorized",
      "visibility": "participant"
    }
  ],
  "joins": [
    {
      "id": "jointure-infos",
      "fragment_ids": [
        "indice-un",
        "indice-deux"
      ],
      "unlock_step": "phase-3"
    }
  ],
  "adaptation": {
    "accompagne": {
      "instruction": "Consignes courtes, pictogrammes et aide disponible, sans étiquette publique."
    },
    "standard": {
      "instruction": "Autonomie progressive et défis adaptés."
    },
    "approfondi": {
      "instruction": "Information partielle, décisions en plusieurs étapes et justification."
    }
  },
  "status": "scenario_skeleton_requires_pedagogical_review"
}
